{
  "$id": "https://openfairy.local/schemas/protocol/v1/tool.result.json",
  "$schema": "https://json-schema.org/draft/2020-12/schema",
  "additionalProperties": true,
  "properties": {
    "actor": {
      "pattern": "^(user|agent|tool|system|subagent:[A-Za-z0-9_.-]+|workflow:[A-Za-z0-9_.-]+)$",
      "type": "string"
    },
    "id": {
      "pattern": "^evt_[0-9A-HJKMNP-TV-Z]{26}$",
      "type": "string"
    },
    "labels": {
      "additionalProperties": true,
      "properties": {
        "residency": {
          "enum": [
            "local-only",
            "region-restricted",
            "global-ok"
          ],
          "type": "string"
        },
        "sensitivity": {
          "enum": [
            "public",
            "internal",
            "personal",
            "secret"
          ],
          "type": "string"
        }
      },
      "required": [
        "sensitivity",
        "residency"
      ],
      "type": "object"
    },
    "payload": {
      "additionalProperties": true,
      "properties": {
        "artifacts": {
          "items": {
            "additionalProperties": true,
            "properties": {
              "hash": {
                "minLength": 1,
                "type": "string"
              },
              "mime": {
                "minLength": 1,
                "type": "string"
              },
              "ref": {
                "minLength": 1,
                "type": "string"
              }
            },
            "required": [
              "ref"
            ],
            "type": "object"
          },
          "type": "array"
        },
        "call_id": {
          "minLength": 1,
          "type": "string"
        },
        "error": {
          "additionalProperties": true,
          "properties": {
            "class": {
              "type": "string"
            },
            "message": {
              "minLength": 1,
              "type": "string"
            }
          },
          "required": [
            "message"
          ],
          "type": "object"
        },
        "labels": {
          "additionalProperties": true,
          "properties": {
            "residency": {
              "enum": [
                "local-only",
                "region-restricted",
                "global-ok"
              ],
              "type": "string"
            },
            "sensitivity": {
              "enum": [
                "public",
                "internal",
                "personal",
                "secret"
              ],
              "type": "string"
            }
          },
          "required": [
            "sensitivity",
            "residency"
          ],
          "type": "object"
        },
        "provenance": {
          "minLength": 1,
          "type": "string"
        },
        "result": {},
        "status": {
          "enum": [
            "ok",
            "error"
          ],
          "type": "string"
        }
      },
      "required": [
        "call_id",
        "status",
        "labels"
      ],
      "type": "object"
    },
    "provenance": {
      "pattern": "^(user|agent|tool:[^\\s]+|web:[^\\s]+|mcp:[^\\s]+)$",
      "type": "string"
    },
    "sid": {
      "pattern": "^ses_[0-9A-HJKMNP-TV-Z]{26}$",
      "type": "string"
    },
    "ts": {
      "pattern": "^\\d{4}-\\d{2}-\\d{2}T\\d{2}:\\d{2}:\\d{2}\\.\\d{3}Z$",
      "type": "string"
    },
    "turn": {
      "minimum": 0,
      "type": "integer"
    },
    "type": {
      "const": "tool.result"
    },
    "v": {
      "const": 1
    }
  },
  "required": [
    "v",
    "id",
    "sid",
    "turn",
    "ts",
    "actor",
    "type",
    "provenance",
    "labels",
    "payload"
  ],
  "title": "Fairy protocol event tool.result v1",
  "type": "object"
}
